<!ELEMENT DBStructure (database)>
<!ELEMENT database (databasename, tables)>
<!ELEMENT tables (table)+>
<!ELEMENT table (tablename, fields)>
<!ELEMENT fields (field)+>
<!ELEMENT field (fieldname, fieldtype)>
<!ELEMENT databasename (#PCDATA)>
<!ELEMENT tablename (#PCDATA)>
<!ELEMENT fieldname (#PCDATA)>
<!ELEMENT fieldtype (#PCDATA)>